index,quote,author,tags,likes
2157,impossible is not a word,"Obert Skye,",inspirational,120
2158,"The heart is like a woman, and the head is like a man, and although man is the head of woman, woman is the heart of man, and she turns man's head because she turns his heart.","Peter Kreeft,",catholicism;christianity;heart;inspirational;jesus-shock;love;man;marriage;philosophy;relationships;spirituality;theology;woman;woman-s-character;woman-s-charm;woman-s-strength,120
2159,"Don't be afraid of the shadows, that only means there's a light nearby.",Evanescence,inspirational;life;wisdom,116
2160,"Yes, terrible things happen, but sometimes those terrible things- they save you.","Chuck Palahniuk,",inspirational,234
2161,"Hiduplah Untuk Memberi yang Sebanyak-banyaknya, Bukan untuk Menerima yang Sebanyak-banyaknya. (Pak Harfan)","Andrea Hirata,",inspirational,233
2162,"Fourscore and seven years ago our fathers brought forth on this continent, a new nation, conceived in Liberty, and dedicated to the proposition that all men are created equal.","Abraham Lincoln,",american-presidents;gettysburg-address;inspirational;us-presidents,222
2163,Don't go on discussing what a good person should be. Just be one.,"Marcus Aurelius,",being;goodness;inspirational;self-actualization;wisdom,213
2164,"Life is full of beauty. Notice it. Notice the bumble bee, the small child, and the smiling faces. Smell the rain, and feel the wind. Live your life to the fullest potential, and fight for your dreams.",Ashley  Smith,beauty;inspirational;joy;life;optimism;positive,210
2165,"Spirituality is not to be learned by flight from the world, or by running away from things, or by turning solitary and going apart from the world. Rather, we must learn an inner solitude wherever or with whomsoever we may be. We must learn to penetrate things and find God there.",Meister Eckhart,inner-peace;inspirational;religion,209
2166,"Now you people have names. That's because you don't know who you are. We know who we are, so we don't need names.","Neil Gaiman,",cats;inspirational;names,183
2167,Successful people have libraries. The rest have big screen TVs,Jim Rohn,inspirational,173
2168,"My life is very monotonous,"" the fox said. ""I hunt chickens: men hunt me. All the chickens are just alike, and all the men are just alike. And, in consequence, I am a little bored. But if you tame me, it will be as if the sun came to shine on my life. I shall know the sound of a step that will be different from all the others. Other steps send me hurrying back underneath the ground. Yours will call me, like music, out of my burrow. And then look: you see the grain fields down yonder? [...] The wheat fields have nothing to say to me. And that is sad. But you have hair that is the color of gold. Think how wonderful that will be when you have tamed me! The grain, which is also golden, will bring me back to the thought of you. And I shall love to listen to the wheat in the wind...",Antoine St,inspirational,165
2169,Storms make trees take deeper roots.,Dolly Parton,inspirational,159
2170,"When life doesn't meet your expectations, it was important to take it with grace.","Patricia Briggs,",grace;inspirational;life,154
2171,Vote for the man who promises least; he'll be the least disappointing.,Bernard Baruch,humor;inspirational,154
2172,"She was broken, I think it’s because she loved too much and she was always blind to the fact that love too is sometimes broken.",robert m drake,happyquotes;hope;inspirational;inspirationalquotes;inspired;instadaily;instaquote;lovequotes;pinquotes;poems;poetry;quote;quoteoftheday;quotes;relationships;rmdrake;sadquotes;sayings;spokenword;tattoo;typewriter;vsco;writer;writing,153
2173,"Dance like you're stamping on a human face forever, love like you've been in a serious car crash that minced the front of your brain, stab like no one can arrest you, and live like there's no such thing as God.",Warren Ellis,comics;inspirational;mad,148
2174,"Once for all, then, a short precept is given thee: Love, and do what thou wilt: whether thou hold thy peace, through love hold thy peace; whether thou cry out, through love cry out; whether thou correct, through love correct; whether thou spare, through love do thou spare: let the root of love be within, of this root can nothing spring but what is good.","Augustine of Hippo,",inspirational;life;love;thelema,148
2175,"When I try, I fail",Corrie ten Boom,inspirational,137
2176,"You can fail at what you don't want, so you might as well take a chance on doing what you love.",Jim Carrey,inspirational,136
2177,A smooth sea never made a skilled sailor.,Franklin D. Roosevelt,inspirational,130
2178,Mother is a verb. It's something you do. Not just who you are.,"Cheryl Lacey Donovan,",family;inspirational;parenting,130
2179,"To be deeply loved, means a willingness to cut yourself wide open, exposing your vulnerabilities... hopes, hurts, fears and flaws. Hiding behind the highlight reel of who you are, is the real you and that person is just as worthy of love. There is nothing more terrifying or fulfilling, than complete love, it's worth the risk... reach for it.",Jaeda DeWalt,being-loved;being-yourself;inspirational;jaeda-dewalt;real-love;relationships;taking-risks;true-love,129
2180,"It is books that are a key to the wide world; if you can't do anything else, read all that you can.",Jane Hamilton,inspirational,128
2181,"Were knowledge all, what were our nee",Christopher Brennan,inspirational;love;philosophical;poetry,125
2182,"Do not fear the thorns in your path, for they draw only corrupt blood.",Kahlil Gibran,inspirational,124
2183,?? ??? ?? ????? ???? ??? ?????? ??????? ... ????? ???????? ?????,"??? ????,",inspirational,121
2184,"Don't let anyone take care of you. Can you maybe leave that for me to do? I mean, take care of you? Feel free to take care of me in return... because I think I'll need you to do that.","Melina Marchetta,",inspirational;the-piper-s-son,119
2185,"To me, when someone wrongs you, you both share the burden of that wrongdoing - the pain of it weighs on both of you. Forgiveness, then, means choosing to bear the full weight all by yourself. Caleb's betrayal is something we both carry, and since he did it, all I've wanted is for him to take its weight away from me. I am not sure that I'm capable of shouldering it all myself - not sure that I am strong enough, or good enough.","Veronica Roth,",inspirational,118
2186,Never follow the crowd.,Bernard Baruch,inspirational,117
2187,If I look at the mass I will never act.,Mother Teresa,activism;apathy;genocide;helplessness;inspirational;power,117
2188,"How can you trust me, after what your own brother did to you?","C.S. Pacat,",damianos-of-akielos;inspirational;laurent-of-vere;trustworthy,116
2189,"I wish that all nations may recover and retain their independence; that those which are overgrown may not advance beyond safe measures of power, that a salutary balance may be ever maintained among nations, and that our peace, commerce, and friendship, may be sought and cultivated by all. It is our business to manufacture for ourselves whatever we can, to keep our markets open for what we can spare or want; and the less we have to do with the amities or enmities of Europe, the better. Not in our day, but at no distant one, we may shake a rod over the heads of all, which may make the stoutest of them tremble","Thomas Jefferson,",inspirational;power,114
2190,"It is a serious thing to live in a society of possible gods and goddesses, to remember that the dullest most uninteresting person you can talk to may one day be a creature which,if you saw it now, you would be strongly tempted to worship, or else a horror and a corruption such as you now meet, if at all, only in a nightmare. All day long we are, in some degree helping each other to one or the other of these destinations. It is in the light of these overwhelming possibilities, it is with the awe and the circumspection proper to them, that we should conduct all of our dealings with one another, all friendships, all loves, all play, all politics. There are no ordinary people. You have never talked to a mere mortal. Nations, cultures, arts, civilizations - these are mortal, and their life is to ours as the life of a gnat. But it is immortals whom we joke with, work with, marry, snub, and exploit - immortal horrors or everlasting splendors.","C.S. Lewis,",inspirational,391
2191,"Do not become someone else just because you are hurt. Be who you are & smile, it may solve, all problems you have got.","Santosh Kalwar,",huomor;inspirational;life;science,226
2192,The level of success you achieve will be in direct proportion to the depth of your commitment.,"Roy T. Bennett,",commitment;inspiration;inspirational;inspirational-attitude;inspirational-life;inspirational-quotes;inspire;inspiring;life;life-and-living;life-lessons;life-quotes;living;motivation;motivational;optimism;optimistic;positive;positive-affirmation;positive-life;positive-thinking;success,216
2193,There i,Lao Tzu,inspirational;tao-te-ching,188
2194,"We spend money that we do not have, on things we do not need, to impress people who do not care.",Will Smith,humor;inspirational,188
2195,"The whole summer lay ahead of us-time to rest, time to wait. And when the future comes-no matter what comes with it-I'll be smarter. I'll be stronger. I'll be ready.","Ally Carter,",inspirational,184
2196,it takes as much courage to have tried and failed as it does to have tried and succeded.,Anne Morrow Lindbergh,courage;inspirational;life,179
2197,I’d rather welcome change than cling to the past.,"Robert T. Kiyosaki,",inspirational,163
2198,Four things to learn in life: To think clearly without hurry or confusion; To love everybody sincerely; To act in everything with the highest motives; To trust God unhesitatingly.,Helen Keller,inspirational,158
2199,"Love cures people, both the ones who give it and the ones who receive it.",Karl Menninger,inspirational;love,153
2200,"If you don’t have the time to do something right, where are you going to find the time to fix it?",Stephen King,inspirational,149
2201,"I will be generous with my love today. I will sprinkle compliments and uplifting words everywhere I go. I will do this knowing that my words are like seeds and when they fall on fertile soil, a reflection of those seeds will grow into something greater.","Steve Maraboli,",compassion;compliments;inspirational;love;motivational;resolution,144
2202,It's been said that love finds you when you're ready.,James Patterson; Maxine Paetro,inspirational,138
2203,"How strange is man that when he is afraid of something he runs away from it, but when he is afraid of Allah, he gets closer to Him.",Hazrat Ali Ibn Abu-Talib A.S,inspirational;respect,132
2204,"What she had long believed was not true, and now the world was wide open to discover what was",Shannon Hale,inspirational,132
2205,"If you set yourself to it, you can live the same life, rich or poor. You can keep on with your books and your ideas. You just got to say to yourself, ""I'm a free man in here"" - he tapped his forehead - ""and you're all right.","George Orwell,",inspirational,131
2206,"A great human revolution in just a single individual will help achieve a change in the destiny of a nation and, further, can even enable a change in the destiny of all humankind.","Daisaku Ikeda,",absolute-happiness;buddhism;destiny;humanism;inspirational;karma;peace;self-reformation,131
2207,Team work makes the dream work,Rap Monster,bts;inspirational;kpop;rap-monster,127
2208,"I should have learned this, she thought. I wanted to learn fire, and pain, but I should have learned people.","Terry Pratchett,",inspirational;life;terry-pratchett;tiffany-aching;truth;witches,124
2209,"And so I ask myself: 'Where are your dreams?' And I shake my head and mutter: 'How the years go by!' And I ask myself again: 'What have you done with those years? Where have you buried your best moments? Have you really lived? Look,' I say to myself, 'how cold it is becoming all over the world!' And more years will pass and behind them will creep grim isolation. Tottering senility will come hobbling, leaning on a crutch, and behind these will come unrelieved boredom and despair. The world of fancies will fade, dreams will wilt and die and fall like autumn leaves from the trees. . . .","Fyodor Dostoevsky,",inspirational,124
2210,Have love for your inner Self and everything else is done for you.,"Amit Ray,",happiness-quotes;inner-peace;inner-strength;inspirational;lifestyle;meditation;self-awareness;self-discovery;spiritual;wisdom,122
2211,Worrying is arrogant because God knows what He's doing.,"Barbara Cameron,",christian-living;inspirational,119
2212,Man is born broken. He lives by mending. The grace of God is glue.,Eugene O'Neill,inspirational,117
2213,This new day has greeted us with no rules; unconditional opportunity. Do not dilute the power of this new day with the hardship of yesterday. Greet this day the way it has greeted you; with open arms and endless possibility.,"Steve Maraboli,",blessings;inspirational;life;new-day;possibilities,116
2214,"When I pictured myself, it was always like just an outline in a colouring book, with the inside not yet completed.",Sarah Dessen,inspirational;someone-like-you;true,116
2215,"In spite of everything I still believe that people are really good at heart. I simply can't build up my hopes on a foundation consisting of confusion, misery and death.","Anne Frank,",inspirational,114
2216,One of the best ways to influence people is to make those around you feel important.,Roy T. Bennett,influence;inspiration;inspirational;inspirational-quotes;inspire;inspiring;leader;leaders;leadership;life;life-quotes;living;motivation;motivational,114
2217,"Everytime I plant a seed,he say kill it before it grow, he say kill it before they grow.",Bob Marley,inspirational,114
2218,Each man should frame life so that at some future hour fact and his dreaming meet.,Victor Hugo,inspirational,114
2219,The sidelines may be safer but life is played on the field,"Wendy Mass,",inspirational,111
2220,We never know how high we are till we are called to rise. Then if we are true to form our statures touch the skies.,"Emily Dickinson,",inspirational,243
2221,Quiet people have the loudest minds.,Stephen King,authors;books;dark;horror;inspirational;inspiring-quotes;minds;quotes;reading;steven-king;writers,232
2222,Brimstone once told me that to stay true in the face of evil is a feat of strength.,"Laini Taylor,",inspirational;karou,226
2223,I cannot trust a man to control others who cannot control himself.,Robert E. Lee,inspirational;leadership;self-control,200
2224,Something amazing happens when you're in love and don't give a damn about what day it is anymore.,Chad Sugg,amazing;happy;inspirational;life;love,167
2225,People are always telling me that i'm not like other girls...that i dont dress like other girls...that i dont act like other girls. But i'm my OWN person...i go to the beat of my own drum.,Miley Cyrus,inspirational,160
2226,"I don't think we get answers to every question. We don't get all the whys. But I think when we look back to the end of our lives, if we do the best we can, and we will see that the things we begged God to take from us, the things we cursed him for, the things that made us turn our backs on him, are the things that were the biggest blessings, the biggest opportunities for growth.","Amy Harmon,",inspirational,156
2227,"And the fox said to the little prince: men have forgotten this truth, but you must not forget it. You become responsible, forever, for what you have tamed.",Antoine de Saint-Exupery,animals;inspirational;responsibility;wisdom,148
2228,"So what? You're another person, so of course you look different. What do you need to be ashamed for?",Yana Toboso,being-different;black-butler;inspirational;kuroshitsuji,141
2229,"?Today is a new day. It's a day you have never seen before and will never see again. Stop telling yourself the 'same crap, different day' lie! How many days has that lie stolen from you? Seize the wonder and uniqueness of today! Recognize that throughout this beautiful day, you have an incredible amount of opportunities to move your life into the direction you want it to go.","Steve Maraboli,",action;carpe-diem;choices;inspirational;life;motivational;new-day;opportunities;seize-the-day;unique,139
2230,"We're called to be faithful, to take those first difficult steps--and to leave the results up to God.",Alex  Harris,faithful;god;hope;inspirational;results;truth,138
2231,Man jadda wajad,Ahmad Fuadi,inspirational,137
2232,"Things will change: you won't feel this way forever. And anyway, sometimes the hardest lessons to learn are the ones your soul needs most.","Kelly Cutrone,",inspirational,132
2233,"It occurred to me by intuition, and music was the driving force behind that intuition. My discovery was the result of musical perception.",Albert Einstein,inspirational,128
2234,Appreciate the moment of a first kiss; it may be the last time you own your heart.,robert m drake,happyquotes;hope;inspirational;inspirationalquotes;inspired;instadaily;instaquote;lovequotes;pinquotes;poems;poetry;quote;quoteoftheday;quotes;relationships;rmdrake;sadquotes;sayings;spokenword;tattoo;typewriter;vsco;writer;writing,127
2235,A dream you dream alone is only a dream. A dream you dream together is reality.,"Yoko Ono,",dream;imagination;inspirational,127
2236,Society will always be too fragile to accept us for all that makes us beautiful.,robert m drake,happyquotes;hope;inspirational;inspirationalquotes;inspired;instadaily;instaquote;lovequotes;pinquotes;poems;poetry;quote;quoteoftheday;quotes;relationships;rmdrake;sadquotes;sayings;spokenword;tattoo;typewriter;vsco;writer;writing,126
2237,"Yet there are moments when the walls of the mind grow thin; when nothing is unabsorbed, and I could fancy that we might blow so vast a bubble that the sun might set and rise in it and we might take the blue of midday and the black of midnight and be cast off and escape from here and now.","Virginia Woolf,",escape;inspirational;life;mind,125
2238,"It is foolish to tear one’s hair in grief, as though sorrow would be made less by baldness.",Marcus Tullius Cicero,advice-for-daily-living;fear-and-loathing;grief;inspirational;sorrow,125
2239,"I want you to have big dreams, big goals. I want you to strive to achieve them. But I don't want to see you beating yourself up every time you make a mistake.","Kelley Armstrong,",inspirational;love;support;supporters,123
2240,"The More we value things, the less we value ourselves",Bruce Lee,inspirational,122
2241,I don't regret the painful times; I bare my scars as if they were medals.,Paolo Coelho,inspirational,122
2242,"Ten spears go to battle,"" he whispered, ""and nine shatter. Did the wa","Brandon Sanderson,",inspirational,120
2243,A thing worth having is a thing worth cheating for.,W.C. Fields,humour;inspirational,114
2244,"Holding a grudge & harboring anger/resentment is poison to the soul. Get even with people...but not those who have hurt us, forget them, instead get even with those who have helped us.","Steve Maraboli,",anger;compassion;grudge;inspirational;life;motivational;people;resentment,114
2245,"Strength is Life, Weakness is Death",Swami Vivekananda,inspirational,114
2246,"Love feels no burden, thinks nothing of its trouble, attempts what is above its strength, pleads no excuse for impossibility, for it thinks all things are lawful for itself and all things are possible",Thomas A. Kempis,inspirational;love,114
2247,Better to shun the bait than struggle in the snare.,William Blake,common-sense;inspirational;wisdom,111
2248,"You don't win races by wishing, you win them by running faster than everyone else does.","Philip Pullman,",inspirational;life,110
2249,"To do something that you feel in your heart that's great, you need to make a lot of mistakes. Anything that's successful is a series of mistakes.",Billie Joe Armstrong,green-day;inspirational;musician,106
2250,You have every right to a beautiful life.,Selena Gomez,inspirational;life;song-lyrics,383
2251,It is our wounds that create in us a desire to reach for miracles. The fulfillment of such miracles depends on whether we let our wounds pull us down or lift us up towards our dreams.,"Jocelyn Soriano,",breakup;broken;broken-heart;broken-hearted;broken-hearted-quotes;dating;faith;healing;heartache;heartbreak;heartbroken;hope;hurt;hurt-feelings;hurting;hurting-heart;inspirational;life;life-lessons;love;romance,204
2252,Happiness depends more on the inward disposition of mind than on outward circumstances.,Benjamin Franklin,inspirational,176
2253,Onward and Upward! To Narnia and the North!,"C.S. Lewis,",inspirational,165
2254,I do like the world quite a lot.,"Shannon Hale,",inspirational,154
2255,"Go and get your things,' he said. 'Dreams mean work.","Paulo Coelho,",dreams;inspirational;work,149
2256,"To separate oneself from the burden, the angst, the anguish that we all encounter everyday. To say I am alive, I am wonderful, I am. I am. That is something to aspire to.","Garth Stein,",inspirational,148
2257,"In the end, everything is a gag.",Charlie Chaplin,humor;inspirational,147
2258,I can't understand why people are frightened of new ideas. I'm frightened of the old ones.,John Cage,ideas;inspirational,146
2259,"God is whispering in your heart, in the whole existence, just tune your ears.","Amit Ray,",god;inspirational;mediation;meditations;motivational;silence;spiritual;spiritual-growth;spirituality,131
2260,"When something is important enough, you do it even if the odds are not in your favour.",Elon Musk,inspirational,131
2261,Me plus you. (Imma tell you one time) Me plus you. (Imma tell you one time,Justin Bieber,actors;girls;inspirational;love;singers;talent,131
2262,Everyone kept telling me not to worry someone will do something. No one did so I became someone and did something.,"Mark A. Cooper,",excuses;inspirational,126
2263,The strength of a man isn't seen in the power of his arms. It's seen in the love with which he EMBRACES you.,"Steve Maraboli,",embrace;happiness;inspirational;love;men;relationships;strength;true-love,124
2264,A successful marriage requires falling in love many times -- always with the same person.,Mignon McLaughlin,inspirational,123
2265,I don't think you should wait. I think you should speak now.,"Taylor Swift,",fearless;inspirational;speak-now;taylor-swift,121
2266,"Indeed, the more we find to love, the more we add to the measure of our hearts.","Lloyd Alexander,",inspirational,120
2267,But there's always a first time for everything,"Melissa de la Cruz,",inspirational,120
2268,You have forgotten the On,"Mawlana Jalal-al-Din Rumi,",inspirational,119
2269,This was not a fearie tale. This was not the movies. This was life. It hurt more. It was excruciating. It was excruciatingly beautiful.,"Francesca Lia Block,",inspirational,118
2270,"No matter who we are, no matter what our circumstances, our feelings and emotions are universal. And music has always been a great way to make people aware of that connection. It can help you open up a part of yourself and express feelings you didn't know you were feeling. It's risky to let that happen. But it's a risk you have to take-because only then will you find you're not alone.",Josh Groban,inspirational;music,116
2271,"Do not let the hero in your soul parish, in lonely frustration, for the life you deserved but never have been able to reach. Check your road and the nature of your battle. The world you desired can be won. It exists, it is real, it is possible, it is yours.","Ayn Rand,",inspirational;john-galt,115
2272,"God is God. He knows what he is doing. When you can’t trace his hand, trust his heart.",Max Lucado (Grace for the Moment),christian;inspirational,115
2273,"Watch for the thing that will show itself to you. Because that thing, when you find it, will be your future.","Arthur Golden,",inspirational,114
2274,"Tuhan kan nggak mungkin langsung sedekah ke orang-orang, ya kalianlah sedekah duit kalau punya duit, sedekah ilmu, sedekah senyum",Sujiwo Tejo,inspirational;spiritual,112
2275,Happiness is the only thing worth fighting for in life.,Lilly Singh,inspirational,109
2276,"We don’t truly appreciate what we have until it’s gone… We don’t really appreciate something until we have experienced some events; we don't really appreciate our parents until we ourselves have become parents. Be grateful for what you have now, and nothing should be taken for granted.",Roy T. Bennett,gratitude;inspiration;inspirational;inspirational-quotes;inspire;inspiring;life;life-quotes;living;optimism;optimistic;positive;positive-affirmation;positive-life;positive-thinking,109
2277,"For too many centuries women have been being muses to artists. I wanted to be the muse, I wanted to be the wife of the artist, but I was really trying to avoid the final issue — that I had to do the job myself.",Anaïs Nin,fearless;feminism;independent;inspirational;muse,108
2278,A revolution is coming – a revolution which will be peaceful if we are wise enough; compassionate if we care enough; successful if we are fortunate enough – but a revolution which is coming whether we will it or not. We can affect its character; we cannot alter its inevitability,Robert F. Kennedy,alliance-for-progress;inspirational;latin-america;latin-american-politics;politics;revolution;truth,107
2279,"Evil exists in us all, Torak. Some fight it. Some feed it. That's how it's always been.",Michelle Paver,inspirational,105
2280,I believe in some blending of hope and sunshine sweetening the worst lots. I believe that this life is not all; neither the beginning nor the end. I believe while I tremble; I trust while I weep.,"Charlotte Bronte,",inspirational,268
2281,"What you do is what matters, not what you think or say or plan.","Jason Fried,",actions;deeds;inspirational;work-ethic,245
