index,quote,author,tags,likes
0,Be yourself; everyone else is already taken.,Oscar Wilde,attributed-no-source;be-yourself;honesty;inspirational;misattributed-oscar-wilde,149270
1,You've gotta dance like there's nobody watching,William W. Purkey,dance;heaven;hurt;inspirational;life;love;sing,118888
2,Be the change that you wish to see in the world.,Mahatma Gandhi,action;change;inspirational;philosophy;wish,106749
3,No one can make you feel inferior without your consent.,"Eleanor Roosevelt,",confidence;inspirational;wisdom,85854
4,Live as if you were to die tomorrow. Learn as if you were to live forever.,Mahatma Gandhi,carpe-diem;education;inspirational;learning,73033
5,Darkness cannot drive out darkness: only light can do that. Hate cannot drive out hate: only love can do that.,"Martin Luther King Jr.,",darkness;drive-out;hate;inspirational;light;love;peace,72616
6,"Without music, life would be a mistake.","Friedrich Nietzsche,",inspirational;music;philosophy,67297
7,We accept the love we think we deserve.,"Stephen Chbosky,",inspirational;love,66047
8,"Imperfection is beauty, madness is genius and it's better to be absolutely ridiculous than absolutely boring.",Marilyn Monroe,attributed-no-source;be-yourself;inspirational,48176
9,There are only two ways to live your life. One is as though nothing is a miracle. The other is as though everything is a miracle.,Albert Einstein,attributed-no-source;inspirational;life;live;miracle;miracles,47424
10,"We are all in the gutter, but some of us are looking at the stars.","Oscar Wilde,",inspirational;optimism;perception;pessimism,42886
11,"Fairy tales are more than true: not because they tell us that dragons exist, but because they tell us that dragons can be beaten.","Neil Gaiman,",books;dragons;fairy-tales;inspirational;paraphrasing-g-k-chesterton,42352
12,"Yesterday is history, tomorrow is a mystery, today is a gift of God, which is why we call it the present.",Bill Keane,attributed-no-source;hope;inspirational;misattributed-eleanor-roosevelt;past;present;widely-misattributed,41144
13,"I have not failed. I've just found 10,000 ways that won't work.",Thomas A. Edison,edison;failure;inspirational;paraphrased,40193
14,"The opposite of love is not hate, it's indifference. The opposite of art is not ugliness, it's indifference. The opposite of faith is not heresy, it's indifference. And the opposite of life is not death, it's indifference.",Elie Wiesel,activism;apathy;hate;indifference;inspirational;love;opposite;philosophy,39330
15,I am enough of an artist to draw freely upon my imagination. Imagination is more important than knowledge. Knowledge is limited. Imagination encircles the world.,Albert Einstein,1929;imagination;inspirational;viereck-interview,36447
16,You have brains in your head. You have feet in your shoes. You can steer yourself any direction you choose. You're on your own. And you know what you know. And YOU are the one who'll decide where to go...,"Dr. Seuss,",inspirational,33253
17,It is never too late to be what you might have been.,George Eliot,inspirational;source-unknown,31772
18,"This life is what you make it. No matter what, you're going to mess up sometimes, it's a universal truth. But the good part is you get to decide how you're going to mess it up. Girls will be your friends - they'll act like it anyway. But just remember, some come, some go. The ones that stay with you through everything - they're your true best friends. Don't let go of them. Also remember, sisters make the best friends in the world. As for lovers, well, they'll come and go too. And baby, I hate to say it, most of them - actually pretty much all of them are going to break your heart, but you can't give up because if you give up, you'll never find your soulmate. You'll never find that half who makes you whole and that goes for everything. Just because you fail once, doesn't mean you're gonna fail at everything. Keep trying, hold on, and always, always, always believe in yourself, because if you don't, then who will, sweetie? So keep your head high, keep your chin up, and most importantly, keep smiling, because life's a beautiful thing and there's so much to smile about.",Marilyn Monroe,attributed-no-source;friends;heartbreak;inspirational;life;love;sisters,31258
19,There is no greater agony than bearing an untold story inside you.,"Maya Angelou,",1970;inspirational;stories;writing,29148
20,Everything you can imagine is real.,Pablo Picasso,art;imagination;inspirational;life,28223
21,You can never get a cup of tea large enough or a book long enough to suit me.,C.S. Lewis,books;inspirational;reading;tea,26307
22,"To the well-organized mind, death is but the next great adventure.","J.K. Rowling,",death;inspirational,24954
23,Life isn't about finding yourself. Life is about creating yourself.,George Bernard Shaw,inspirational;life;yourself,24601
24,"Do what you can, with what you have, where you are.",Theodore Roosevelt,inspirational,22963
25,"Listen to the mustn'ts, child. Listen to the don'ts. Listen to the shouldn'ts, the impossibles, the won'ts. Listen to the never haves, then listen close to me... Anything can happen, child. Anything can be.",Shel Silverstein,anything-can-be;hope;impossible;inspirational;musn-t;possibilities;shouldn-t;won-t,22129
26,"When one door of happiness closes, another opens; but often we look so long at the closed door that we do not see the one which has been opened for us.",Helen Keller,inspirational,21945
27,"Success is not final, failure is not fatal: it is the courage to continue that counts.",Winston S. Churchill,bravery;courage;failure;inspirational;success,21761
28,"So, this is my life. And I want you to know that I am both happy and sad and I'm still trying to figure out how that could be.","Stephen Chbosky,",charlie;favourite-books;inspirational;sad;soul-searching;wallflower,21230
29,"You may say I'm a dreamer, but I'm not the only one. I hope someday you'll join us. And the world will live as one.",John Lennon,beatles;connection;dreamers;dreaming;dreams;hope;inspirational;peace,18379
30,"And, when you want something, all the universe conspires in helping you to achieve it.","Paulo Coelho,",inspirational,18157
31,"Our deepest fear is not that we are inadequate. Our deepest fear is that we are powerful beyond measure. It is our light, not our darkness that most frightens us. We ask ourselves, 'Who am I to be brilliant, gorgeous, talented, fabulous?' Actually, who are you not to be? You are a child of God. Your playing small does not serve the world. There is nothing enlightened about shrinking so that other people won't feel insecure around you. We are all meant to shine, as children do. We were born to make manifest the glory of God that is within us. It's not just in some of us; it's in everyone. And as we let our own light shine, we unconsciously give other people permission to do the same. As we are liberated from our own fear, our presence automatically liberates others.","Marianne Williamson,",akeelah;fear;inspirational,16703
32,"It’s no use going back to yesterday, because I was a different person then.",Lewis Carroll,alice;humor;inspirational;philosophy-of-life;psychological;yesterday,16460
33,"What you're supposed to do when you don't like a thing is change it. If you can't change it, change the way you think about it. Don't complain.","Maya Angelou,",1993;advice;complaining;inspirational,14892
34,It's the possibility of having a dream come true that makes life interesting.,"Paulo Coelho,",inspirational,14669
35,"A person's a person, no matter how small.","Dr. Seuss,",inspirational,14552
36,"He’s not perfect. You aren’t either, and the two of you will never be perfect. But if he can make you laugh at least once, causes you to think twice, and if he admits to being human and making mistakes, hold onto him and give him the most you can. He isn’t going to quote poetry, he’s not thinking about you every moment, but he will give you a part of him that he knows you could break. Don’t hurt him, don’t change him, and don’t expect for more than he can give. Don’t analyze. Smile when he makes you happy, yell when he makes you mad, and miss him when he’s not there. Love hard when there is love to be had. Because perfect guys don’t exist, but there’s always one guy that is perfect for you.",Bob Marley,inspirational;love,14375
37,"When we honestly ask ourselves which person in our lives mean the most to us, we often find that it is those who, instead of giving advice, solutions, or cures, have chosen rather to share our pain and touch our wounds with a warm and tender hand. The friend who can be silent with us in a moment of despair or confusion, who can stay with us in an hour of grief and bereavement, who can tolerate not knowing, not curing, not healing and face with us the reality of our powerlessness, that is a friend who cares.","Henri Nouwen,",empathy;friends;friendship;inspirational,13735
38,"You can't live your life for other people. You've got to do what's right for you, even if it hurts some people you love.","Nicholas Sparks,",inspirational;the-notebook,13398
39,Well-behaved women seldom make history.,"Laurel Thatcher Ulrich,",inspirational;misattributed-eleanor-roosevelt;women,12363
40,"When I despair, I remember that all through history the way of truth and love have always won. There have been tyrants and murderers, and for a time, they can seem invincible, but in the end, they always fall. Think of it--always.",Mahatma Gandhi,despair;evil;goodness;inspirational;love;sadness;truth;victory,11563
41,"So we beat on, boats against the current, borne back ceaselessly into the past.","F. Scott Fitzgerald,",book;inspirational,11409
42,"Nothing is impossible, the word itself says 'I'm possible'!",Audrey Hepburn,attributed-no-source;inspirational,11397
43,"I can't give you a sure-fire formula for success, but I can give you a formula for failure: try to please everybody all the time.",Herbert Bayard Swope,failure;inspirational;misattributed-bill-cosby;success,11105
44,Do what you feel in your heart to be right – for you’ll be criticized anyway.,Eleanor Roosevelt,inspirational,11074
45,"[...]the only people for me are the mad ones, the ones who are mad to live, mad to talk, mad to be saved, desirous of everything at the same time, the ones who never yawn or say a commonplace thing, but burn, burn, burn like fabulous yellow roman candles exploding like spiders across the stars and in the middle you see the blue centerlight pop and everybody goes “Awww!","Jack Kerouac,",freethinker;inspirational;mad,11070
46,Happiness is not something ready made. It comes from your own actions.,Dalai Lama XIV,happiness;inspirational,10808
47,Peace begins with a smile..,Mother Teresa,inspirational;peace;smile;smiling,10710
48,"Never doubt that a small group of thoughtful, committed, citizens can change the world. Indeed, it is the only thing that ever has.",Margaret Mead,activism;attributed-no-source;change;inspirational;life;philosophy;world,10637
49,"Do not read, as children do, to amuse yourself, or like the ambitious, for the purpose of instruction. No, read in order to live.",Gustave Flaubert,books;inspirational;life;reading,10563
50,"Imagining the future is a kind of nostalgia. (...) You spend your whole life stuck in the labyrinth, thinking about how you'll escape it one day, and how awesome it will be, and imagining that future keeps you going, but you never do it. You just use the future to escape the present.","John Green,",inspirational,10509
51,What lies behind us and what lies before us are tiny matters compared to what lies within us.,Ralph Waldo Emerson,inspirational,10278
52,"For attractive lips, speak words of kindness","Sam Levenson,",beauty;charity;inspirational;kindness;misattributed-audrey-hepburn,10214
53,Promise Yoursel,"Christian D. Larson,",happiness;inspirational;love;optimism;strength,9930
54,"Friendship is unnecessary, like philosophy, like art.... It has no survival value; rather it is one of those things which give value to survival.","C.S. Lewis,",friendship;inspirational,9924
55,"Whatever you are, be a good one.",Abraham Lincoln,inspirational,9813
56,"I hope she'll be a fool -- that's the best thing a girl can be in this world, a beautiful little fool.","F. Scott Fitzgerald,",inspirational;women,9705
57,"Two wrongs don't make a right, but they make a good excuse.",Thomas Szasz,humor;inspirational,9591
58,First they ignore you. Then they ridicule you. And then they attack you and want to burn you. And then they build monuments to you.,Nicholas Klein,conflict;fighting;inspirational;misattributed-to-gandhi;trial,9470
59,May you live every day of your life.,Jonathan Swift,inspirational;life;philosophy;wisdom,9340
60,I believe that imagination is stronger than knowledge. That myth is more potent than history. That dreams are more powerful than facts. That hope always triumphs over experience. That laughter is the only cure for grief. And I believe that love is stronger than death.,"Robert Fulghum,",hope;imagination;inspirational,8987
61,Who controls the past controls the future. Who controls the present controls the past.,"George Orwell,",inspirational,8799
62,You can't stay in your corner of the Forest waiting for others to come to you. You have to go to them sometimes.,"A.A. Milne,",friendship;inspirational;pooh;winnie,8707
63,Isn't it nice to think that tomorrow is a new day with no mistakes in it yet?,L.M. Montgomery,beginnings;fresh-start;inspirational;mistake;mistakes;new-day;start-over;tomorrow,8519
64,"If my life is going to mean anything, I have to live it myself.","Rick Riordan,",inspirational;life;meaning,8480
65,"You can talk with someone for years, everyday, and still, it won't mean as much as what you can have when you sit in front of someone, not saying a word, yet you feel that person with your heart, you feel like you have known the person for forever.... connections are made with the heart, not the tongue.",C. JoyBell C.,affection;communication;heartwarming;human-connections;human-nature;humanism;humanity;inspirational;inspirational-life;inspirational-love;inspirational-quotes;relationships,8149
66,Hope is the thing with feather,Emily Dickinson,feathers;hope;inspirational;souls,8093
67,"And once the storm is over, you won’t remember how you made it through, how you managed to survive. You won’t even be sure, whether the storm is really over. But one thing is certain. When you come out of the storm, you won’t be the same person who walked in. That’s what this storm’s all about.",haruki murakami,adversity;inspirational;life-lessons;problems;trials,8012
68,"When I was 5 years old, my mother always told me that happiness was the key to life. When I went to school, they asked me what I wanted to be when I grew up. I wrote down ‘happy’. They told me I didn’t understand the assignment, and I told them they didn’t understand life.",John Lennon,inspirational;life,7929
69,Always do what you are afraid to do.,Ralph Waldo Emerson,inspirational,7829
70,Pain is inevitable. Suffering is optional.,"haruki murakami,",inspirational;running,7779
71,Our lives begin to end the day we become silent about things that matter.,"Martin Luther King Jr.,",inspirational,7762
72,If you're reading this..,"Chad Sugg,",alive;congratulations;hope;humanity;inspiration;inspirational;inspire;life;poetry;smile;wisdom,7721
73,"There is neither happiness nor misery in the world; there is only the comparison of one state with another, nothing more. He who has felt the deepest grief is best able to experience supreme happiness. We must have felt what it is to die, Morrel, that we may appreciate the enjoyments of life",Alexandre Dumas,hope;inspirational;wisdom,7709
74,"In the end, we will remember not the words of our enemies, but the silence of our friends.",Martin Luther King Jr.,inspirational,7642
75,"Do not let your fire go out, spark by irreplaceable spark in the hopeless swamps of the not-quite, the not-yet, and the not-at-all. Do not let the hero in your soul perish in lonely frustration for the life you deserved and have never been able to reach. The world you desire can be won. It exists.. it is real.. it is possible.. it's yours.","Ayn Rand,",inspirational;life,7632
76,Talent hits a target no one else can hit. Genius hits a target no one else can see.,Arthur Schopenhauer,inspirational;talent,7570
77,It is so hard to leave—until you leave. And then it is the easiest goddamned thing in the world.,"John Green,",inertia;inspirational;leaving;nerdfighter,7544
78,"The mind is its own place, and in itself can make a heaven of hell, a hell of heaven..","John Milton,",inspirational;religion,7514
79,Fantasy is hardly an escape from reality. It's a way of understanding it.,Lloyd Alexander,fantasy;inspirational;writing,7227
80,Waiting is painful. Forgetting is painful. But not knowing which to do is the worst kind of suffering.,"Paulo Coelho,",inspirational,7194
81,"The world is indeed full of peril, and in it there are many dark places; but still there is much that is fair, and though in all lands love is now mingled with grief, it grows perhaps the greater.","J.R.R. Tolkien,",hope;inspirational;love,7030
82,"Do not go where the path may lead, go instead where there is no path and leave a trail.",Ralph Waldo Emerson,inspirational;life,7008
83,I can be changed by what happens to me. But I refuse to be reduced by it,"Maya Angelou,",be-yourself;inspirational;misquote;self-determination,6953
84,Never let your sense of morals prevent you from doing what is right.,"Isaac Asimov,",humor;inspirational;philosophy;wisdom,6753
85,Hell is empty and all the devils are here.,"William Shakespeare,",inspirational,6736
86,"If you can't fly then run, if you can't run then walk, if you can't walk then crawl, but whatever you do you have to keep moving forward.",Martin Luther King Jr.,inspirational,6721
87,"It is not the critic who counts; not the man who points out how the strong man stumbles, or where the doer of deeds could have done them better. The credit belongs to the man who is actually in the arena, whose face is marred by dust and sweat and blood; who strives valiantly; who errs, who comes short again and again, because there is no effort without error and shortcoming; but who does actually strive to do the deeds; who knows great enthusiasms, the great devotions; who spends himself in a worthy cause; who at the best knows in the end the triumph of high achievement, and who at the worst, if he fails, at least fails while daring greatly, so that his place shall never be with those cold and timid souls who neither know victory nor defeat.",Theodore Roosevelt,inspirational;politics;presidential,6670
88,I love to see a young girl go out and grab the world by the lapels. Life's a bitch. You've got to go out and kick ass.,maya angelou,humor;inspirational;life,6577
89,Turn your wounds into wisdom.,Oprah Winfrey,experience;inspirational;pain;wisdom;wounds,6534
90,"When you have eliminated all which is impossible, then whatever remains, however improbable, must be the truth.","Arthur Conan Doyle,",inspirational,6488
91,"If you remember me, then I don't care if everyone else forgets.","Haruki Murakami,",inspirational;love,6283
92,War is peace,"George Orwell,",freedom;ignorance;inspirational;war,6103
93,Prayer is not asking. It is a longing of the soul. It is daily admission of one's weakness. It is better in prayer to have a heart without words than words without a heart.,Mahatma Gandhi,god;heart;humanity;inspirational;prayer;religion;souls;weakness,6085
94,Attitude is a choice. Happiness is a choice. Optimism is a choice. Kindness is a choice. Giving is a choice. Respect is a choice. Whatever choice you make makes you. Choose wisely.,"Roy T. Bennett,",attitude;choice;choices;giving;happiness;inspiration;inspirational;inspirational-attitude;inspirational-life;inspirational-quotes;inspire;inspiring;kindness;life;life-and-living;life-lessons;life-quotes;living;motivation;motivational;optimism;optimistic;positive;positive-affirmation;positive-life;positive-thinking;respect,6041
95,It isn't what you have or who you are or where you are or what you are doing that makes you happy or unhappy. It is what you think about it.,"Dale Carnegie,",attitude;contentment;happiness;inspirational;life,5936
96,"What I need is the dandelion in the spring. The bright yellow that means rebirth instead of destruction. The promise that life can go on, no matter how bad our losses. That it can be good again.","Suzanne Collins,",inspirational;love,5924
97,"And, in the en","Paul McCartney,",beatles;inspirational;live;love;music,5913
98,The future belongs to those who believe in the beauty of their dreams.,Eleanor Roosevelt,dreams;future;inspirational;misattributed-eleanor-roosevelt,5848
99,"I don't trust people who don't love themselves and tell me, 'I love you.' ... There is an African saying which is: Be careful when a naked person offers you a shirt.",Maya Angelou,1997;annie-clark-tanner-lecture;inspirational;love;trust,5815
100,"I like living. I have sometimes been wildly, despairingly, acutely miserable, racked with sorrow; but through it all I still know quite certainly that just to be alive is a grand thing.",Agatha Christie,inspirational,5781
101,"I am not sure exactly what heaven will be like, but I know that when we die and it comes time for God to judge us, he will not ask, 'How many good things have you done in your life?' rather he will ask, 'How much love did you put into what you did?",Mother Teresa,inspirational;love,5730
102,"We’re all seeking that special person who is right for us. But if you’ve been through enough relationships, you begin to suspect there’s no right person, just different flavors of wrong. Why is this? Because you yourself are wrong in some way, and you seek out partners who are wrong in some complementary way. But it takes a lot of living to grow fully into your own wrongness. And it isn’t until you finally run up against your deepest demons, your unsolvable problems—the ones that make you truly who you are—that we’re ready to find a lifelong mate. Only then do you finally know what you’re looking for. You’re looking for the wrong person. But not just any wrong person: it's got to be the right wrong person—someone you lovingly gaze upon and think, “This is the problem I want to have.","Andrew  Boyd,",being-loved;completion;inspirational;love;relationships,5607
103,"I do not fear death. I had been dead for billions and billions of years before I was born, and had not suffered the slightest inconvenience from it.",Mark Twain,death;inspirational,5428
104,Don't judge each day by the harvest you reap but by the seeds that you plant.,Robert Louis Stevenson,day;inspirational;judge;plant;reap;seed;seeds;sow,5427
105,"But I know, somehow, that only when it is dark enough can you see the stars.","Martin Luther King, Jr.",hope;inspirational,5392
106,None but ourselves can free our minds.,Bob Marley,bob-marley;inspirational;music;reggae,5337
107,Don't be pushed around by the fears in your mind. Be led by the dreams in your heart.,"Roy T. Bennett,",dreams;fearless;heart;inspiration;inspirational;inspirational-attitude;inspirational-life;inspirational-quotes;inspire;inspiring;life;life-and-living;life-lessons;life-quotes;living;mind;motivation;motivational;optimism;optimistic;positive;positive-affirmation;positive-life;positive-thinking,5189
108,"Sometimes our light goes out, but is blown again into instant flame by an encounter with another human being.",Albert Schweitzer,inspirational;life;spiritual;uplifting,5165
109,"Simplicity, patience, compassion","Lao Tzu,",inspirational;life;philosophy,5148
110,"The truth is, unless you let go, unless you forgive yourself, unless you forgive the situation, unless you realize that the situation is over, you cannot move forward.","Steve Maraboli,",forgiveness;inspirational;letting-go;life;motivational;moving-forward;truth,5037
111,"Clouds come floating into my life, no longer to carry rain or usher storm, but to add color to my sunset sky.","Rabindranath Tagore,",aspiration;assurance;beauty;clouds;color;conviction;inspirational;maturity;sunset,5026
112,"People say nothing is impossible, but I do nothing every day.","A.A. Milne,",humor;idleness;inspirational,4945
113,"Instead of worrying about what you cannot control, shift your energy to what you can create.","Roy T. Bennett,",creation;creative;inspiration;inspirational;inspirational-attitude;inspirational-life;inspirational-quotes;inspire;inspiring;life;life-and-living;life-lessons;life-quotes;living;optimism;optimistic;positive;positive-affirmation;positive-life;positive-thinking;worry,4935
114,A woman's heart should be so hidden in God that a man has to seek Him just to find her.,Max Lucado,inspirational;love,4875
115,It's kind of fun to do the impossible.,Walt Disney,inspirational,4871
116,"The things you do for yourself are gone when you are gone, but the things you do for others remain as your legacy.",Kalu Ndukwe Kalu,hope;inspiration;inspirational;life;truth,4863
117,"A painter should begin every canvas with a wash of black, because all things in nature are dark except where exposed by the light.",Leonardo da Vinci,art;inspirational,4838
118,Dare to B,"Steve Maraboli,",compassion;dare-to-be;gratitude;inspirational;life;motivational;seize-the-day;smile;success,4835
119,Pain is temporary. Quitting lasts forever.,"Lance Armstrong Sally Jenkins,",cancer;failure;inspiration;inspirational;pain;quitting,4809
