index,quote,author,tags,likes
1474,I'm beginning to think that maybe it's not just how much you love someone. Maybe what matters is who you are when you're with them.,"Anne Tyler,",inspirational;love,313
1475,"A Nation should not be judged by how it treats its highest citizens, but it's lowest ones","Nelson Mandela,",freedom;inspirational;politics;revolution;struggle,287
1476,"When I get sad, I stop being sad and be awesome instead.",Barney Stinson,humor;inspirational,275
1477,"I keep thinking about a tale my nurse used to read to me about a bird whose wings are pinned to the ground. In the end, when he finally frees himself, he flies so high he becomes a star. My nurse said the story was about how we all have something that keeps us down.","Shannon Hale,",inspirational,275
1478," Many of us are slaves to our minds. Our own mind is our worst enemy. We try to focus, and our mind wanders off. We try to keep stress at bay, but anxiety keeps us awake at night. We try to be good to the people we love, but then we forget them and put ourselves first. And when we want to change our life, we dive into spiritual practice and expect quick results, only to lose focus after the honeymoon has worn off. We return to our state of bewilderment. We're left feeling helpless and discouraged. It seems we all agree that training the body through exercise, diet, and relaxation is a good idea, but why don't we think about training our minds?",Sakyong Mipham Rinpoche,inspirational;spiritual,274
1479,"No man is brave that has never walked a hundred miles. If you want to know the truth of who you are, walk until not a person knows your name. Travel is the great leveler, the great teacher, bitter as medicine, crueler than mirror-glass. A long stretch of road will teach you more about yourself than a hundred years of quiet.",Patrick Rothfuss,inspirational;travel,266
1480,Champions have the courage to keep turning the pages because they know a better chapter lies ahead.,Paula White,inspirational,265
1481,Kecantikan yang abadi terletak pada keelokan adab dan ketinggian ilmu seseorang. Bukan terletak pada wajah dan pakaiannya.,Hamka,inspirational,261
1482,Your own positive future begins in this moment. All you have is right now. Every goal is possible from here.,Lao Tzu,inspirational,258
1483,Do not pray for easy lives. Pray to be stronger men,John F. Kennedy,inspirational;prayer;strength,255
1484,"Happiness is the object and design of our existence; and will be the end thereof, if we pursue the path that leads to it; and this path is virtue, uprightness, faithfulness, holiness, and keeping all the commandments of God.",Joseph Smith,god;happiness;inspirational;mormonism;religion;virtue,253
1485,Smile at strangers and you just might change a life.,Steve Maraboli,change-a-life;compassion;inspirational;smile;strangers,252
1486,"Each of us has the right and the responsibility to assess the roads which lie ahead, and those over which we have traveled, and if the future road looms ominous or unpromising, and the roads back uninviting, then we need to gather our resolve and, carrying only the necessary baggage, step off that road into another direction. If the new choice is also unpalatable, without embarrassment, we must be ready to change that as well.","Maya Angelou,",inspirational,251
1487,"If people are going to be allowed to say ""we love you"" and ""I love you"", they'd better have the backbone to prove it. Love isn't just a word.",C. JoyBell C.,inspirational;inspirational-love;inspirational-quotes;love;real-love,251
1488,"My happiness grows in direct proportion to my acceptance, and in inverse proportion to my expectations.",Michael J. Fox,acceptance;happiness;inspirational,250
1489,Always tell what you feel. Do what you think...,Gabriel García Márquez,inspirational,250
1490,"The sea's only gifts are harsh blows, and occasionally the chance to feel strong. Now I don't know much about the sea, but I do know that that's the way it is here. And I also know how important it is in life not necessarily to be strong but to feel strong. To measure yourself at least once. To find yourself at least once in the most ancient of human conditions. Facing the blind death stone alone, with nothing to help you but your hands and your own head.","Jon Krakauer,",inspirational,249
1491,"I know in my heart that man is good, that what is right will always eventually triumph, and there is purpose and worth to each and every life.",Ronald Reagan,inspirational,249
1492,"Life isn't about having, it's about being. You could surround yourself with all that money can buy, and you'd still be as miserable as a human can be. I know people with perfect bodies who don't have half the happiness I've found. On my journeys I've seen more joy in the slums of Mumbai and the orphanages of Africa than in wealthy gated communities and on sprawling estates worth millions. Why is that? You'll find contentment when your talents and passion are completely engaged, in full force. Recognise instant self-gratification for what it is. Resist the temptation to grab for material objects like the perfect house, the coolest clothes or the hottest car. The if I just had X, I would be happy syndrome is a mass delusion. When you look for happiness in mere objects, they are never enough. Look around. Look within.",Nick Vujicic,inspirational,245
1493,"you don't have to worry about burning bridges, if you're building your own",Kerry E. Wagner,accountability;inspirational;ownership;resourcefulness;responsibility;self-help;self-reliance,245
1494,You could do a lot worse.,"Suzanne Collins,",inspirational,244
1495,"You have to be the bravest person in the world to go out every day, being yourself when no one likes who you are.","Matthew Dicks,",autism;bravery;inspirational,243
1496,You make the world a better place by making daily improvements to become the best version of yourself.,Roy T. Bennett,improvement;inspiration;inspirational;inspirational-attitude;inspirational-life;inspirational-quotes;inspire;inspiring;life;life-and-living;life-lessons;life-quotes;living;motivation;motivational;optimism;optimistic;positive;positive-affirmation;positive-life;positive-thinking,241
1497,Never stop. Never stop fighting. Never stop dreaming.,Tom Hiddleston,inspirational;tom-hiddleston,240
1498,Success is the ability to go from failure to failure without losing your enthusiasm,Winston Churchill,inspirational,240
1499,"Love doesn't always come when you want it to. Sometimes it just happens, despite your will.","V.C. Andrews,",inspirational;love;truth,238
1500,Travel is never a matter of money but of courage,"Paulo Coelho,",inspirational;philosophy,348
1501,It serves me right for putting all my eggs in one bastard.,"Dorothy Parker,",abortion;inspirational,347
1502,Music is an agreeable harmony for the honor of God and the permissible delights of the soul.,Johann Sebastian Bach,christian;inspirational;music;power-of-music,339
1503,"Courage does not always roar. Sometimes courage is the quiet voice at the end of the day saying, 'I will try again tomorrow.",Mary Anne Radmacher,courage;inspirational;perseverance,336
1504,"Those three things - autonomy, complexity, and a connection between effort and reward - are, most people will agree, the three qualities that work has to have if it is to be satisfying.","Malcolm Gladwell,",inspirational,313
1505,"The amazing thing is that every atom in your body came from a star that exploded. And, the atoms in your left hand probably came from a different star than your right hand. It really is the most poetic thing I know about physics: You are all stardust. You couldn’t be here if stars hadn’t exploded, because the elements - the carbon, nitrogen, oxygen, iron, all the things that matter for evolution - weren’t created at the beginning of time. They were created in the nuclear furnaces of stars, and the only way they could get into your body is if those stars were kind enough to explode. So, forget Jesus. The stars died so that you could be here today.","Lawrence M. Krauss,",inspirational;stardust;universe,305
1506,You must expect great things of yourself before you can do them.,Michael Jordan,inspirational;success,301
1507,"Go for it, while you can. I know you have it in you. And I can't promise you'll get everything you want, but I can promise nothing will change if you don't try.","J.M. Darhower,",inspirational;life;promises;risks;sempre,299
1508,"To those who will see, the world waits.",Libba Bray,inspirational,296
1509,"Good works is giving to the poor and the helpless, but divine works is showing them their worth to the One who matters.","Criss Jami,",beautiful;christ-like;compassion;consideration;divine-love;divine-works;empathy;faith;giving;god-like;good-works;helping-others;inspirational;jesus;life;poor;sympathy;the-one;unconditional-love;value;works;worth,296
1510,Everything you want is on the other side of fear.,Jack Canfield,fear;inspirational,288
1511,"Men and women who turn their lives over to God will discover that He can make a lot more out of their lives than they can. He can deepen their joys, expand their vision, quicken their minds, strengthen their muscles, lift their spirits, multiply their blessings, increase their opportunities, comfort their soals, and pour out peace.",Ezra Taft Benson,faith;inspirational,280
1512,"No matter how hard life is, don't lose hope",Zayn Malik,inspirational;life;one-direction,277
1513,"Man cannot possess anything as long as he fears death. But to him who does not fear it, everything belongs. If there was no suffering, man would not know his limits, would not know himself. ","Leo Tolstoy,",death;inspirational,275
1514,A bird is safe in its nest - but that is not what its wings are made for.,"Amit Ray,",bird;inspirational;inspirational-quotes;philosophy;philosophy-of-life;true-purpose;wings;wisdom;wisdom-quote,271
1515,"Wait long enough and people will surprise and impress. When you're pissed off at someone and you're angry at them, you just haven't given them enough time. Just give them a little more time and they almost always will impress you.",Randy Pausch,inspirational,270
1516,"When men are pure, laws are useless; when men are corrupt, laws are broken.",Benjamin Disraeli,inspirational;truth,262
1517,Til shade is gone,"Robert Jordan,",bad-ass;inspirational,250
1518,"As soon as you honor the present moment, all unhappiness and struggle dissolve, and life begins to flow with joy and ease. When you act out the present-moment awareness, whatever you do becomes imbued with a sense of quality, care, and love - even the most simple action.","Eckhart Tolle,",inspirational,245
1519,"Wherever men and women are persecuted because of their race, religion, or political views, that place must — at that moment — become the center of the universe.",Elie Wiesel,human-rights;inspirational;responsibility,241
1520,Perfect is the enemy of good.,Voltaire,inspirational;misattributed-to-jim-collins;work-ethic,239
1521,"The personal, as everyone’s so fucking fond of saying, is political. So if some idiot politician, some power player, tries to execute policies that harm you or those you care about, take it personally. Get angry. The Machinery of Justice will not serve you here – it is slow and cold, and it is theirs, hardware and soft-. Only the little people suffer at the hands of Justice; the creatures of power slide from under it with a wink and a grin. If you want justice, you will have to claw it from them. Make it personal. Do as much damage as you can. Get your message across. That way, you stand a better chance of being taken seriously next time. Of being considered dangerous. And make no mistake about this: being taken seriously, being considered dangerous marks the difference - the only difference in their eyes - between players and little people. Players they will make deals with. Little people they liquidate. And time and again they cream your liquidation, your displacement, your torture and brutal execution with the ultimate insult that it’s just business, it’s politics, it’s the way of the world, it’s a tough life and that it’s nothing personal. Well, fuck them. Make it personal.","Richard K. Morgan,",anti-establishment;inspirational;kickass,239
1522,"However beautiful the strategy, you should occasionally look at the results.",Winston Churchill,inspirational,239
1523,You can't dwell on what might have been...and it's not fair to condemn him for something he hasn't done.,"Wendelin Van Draanen,",grandpa-chet;inspirational;prejudice;wisdom,239
1524,What helps you persevere is your resilience and commitment.,"Roy T. Bennett,",commitment;inspiration;inspirational;inspirational-attitude;inspirational-life;inspirational-quotes;inspire;inspiring;life;life-and-living;life-lessons;life-quotes;living;motivation;motivational;optimism;optimistic;perseverance;positive;positive-affirmation;positive-life;positive-thinking;resilience,238
1525,"Fear tends to come from ignorance. Once I knew what the problem was, it was just a problem, nothing to fear.","Patrick Rothfuss,",inspirational,237
1526,"I always cheer up immensely if an attack is particularly wounding because I think, well, if they attack one personally, it means they have not a single political argument left.",Margaret Thatcher,humor;inspirational;politics;slander;wisdom,234
1527,It is harder to crack prejudice than an atom.,Albert Einstein,humor;inspirational;science,233
1528,Listen to what you know instead of what you fear.,Richard Bach,inspirational;life-lessons,232
1529,"If you do what you've always done, you'll get what you've always gotten. ",Tony Robbins,educational;inspirational;instructive,232
1530,Never bend your head. Hold it high. Look the world straight in the eye.,Helen Keller,inspirational,546
1531,"That proves you are unusual,"" returned the Scarecrow; ""and I am convinced that the only people worthy of consideration in this world are the unusual ones. For the common folks are like the leaves of a tree, and live and die unnoticed.","L. Frank Baum,",inspirational;random;unusual;weird,465
1532,"Always be yourself, there's no one better!",Selena Gomez,inspirational,432
1533,"Come friends, it's not too late to seek a newer world.",Alfred Lord Tennyson,advice;encouragement;hope;inspirational,334
1534,"If I had to choose between betraying my country and betraying my friend, I hope I should have the guts to betray my country.","E.M. Forster,",friendship;honour;inspirational,324
1535,"I do not believe that sheer suffering teaches. If suffering alone taught, all the world would be wise, since everyone suffers. To suffering must be added mourning, understanding, patience, love, openness, and the willingness to remain vulnerable.","Anne Morrow Lindbergh,",inspirational,321
1536,"Because,"" explained Mary Rommely simply, ""the child must have a valuable thing which is called imagination. The child must have a secret world in which live things that never were. It is necessary that she believe. She must start out by believing in things not of this world. Then when the world becomes too ugly for living in, the child can reach back and live in her imagination. I, myself, even in this day and at my age, have great need of recalling the miraculous lives of the Saints and the great miracles that have come to pass on earth. Only by having these things in my mind can I live beyond what I have to live for.","Betty Smith,",believe;imagination;inspirational;life,318
1537,"What if the kid you bullied at school, grew up, and turned out to be the only surgeon who could save your life?",Lynette Mather,bullying;inspirational;kids;thoughts-on-life,316
1538,Everything that is done in this world is done by hope.,Martin Luther,hope;inspirational,282
1539,"Try, reach, want, and you may fall. But even if you do, you might be okay anyway","Ann Brashares,",inspirational,278
1540,One must always be prepared for riotous and endless waves of transformation.,"Elizabeth Gilbert,",inspirational;motivational,277
1541,"A dog has no use for fancy cars or big homes or designer clothes. Status symbol means nothing to him. A waterlogged stick will do just fine. A dog judges others not by their color or creed or class but by who they are inside. A dog doesn't care if you are rich or poor, educated or illiterate, clever or dull. Give him your heart and he will give you his. It was really quite simple, and yet we humans, so much wiser and more sophisticated, have always had trouble figuring out what really counts and what does not. As I wrote that farewell column to Marley, I realized it was all right there in front of us, if only we opened our eyes. Sometimes it took a dog with bad breath, worse manners, and pure intentions to help us see.",John Grogan,inspirational,277
1542,You think of yoursel,"Rumi,",inspirational;iran;persian-poetry;rumi;rumi-poetry,277
1543,"When you say ""I"" and ""my"" too much, you lose the capacity to understand the ""we"" and ""our"".","Steve Maraboli,",inspirational;life;love;relationships;understanding-others,264
1544,Of all the wonders that I have heard,"William Shakespeare,",death;inspirational,258
1545,"All human beings should try to learn before they die what they are running from, and to, and why.",James Thurber,aphorism;inspirational,253
1546,"When one door closes another door opens; but we so often look so long and so regretfully upon the closed door, that we do not see the ones which open for us.",Alexander Graham Bell,inspirational;opportunity,253
1547,There's no limit to what you can dream. Yo,Cecelia Ahern,dreams;inspirational;love,251
1548,You are never alone. You are eternally connected with everyone.,"Amit Ray,",advaita;advaita-vedanta;alone;aloneness;awakening;awareness;enlightenment;eternal;eternal-life;eternal-truths;everyone;everyone-belongs;global-oneness;insights;inspirational;interconnectedness;life;life-lessons;loneliness;motivational;non-duality;nonduality;oneness;spiritual-growth;spiritual-quotes;spirituality;unity;vedanta;wisdom;wisdom-quotes,249
1549,"The great secret of true success, of true happiness, is this: the man or woman who asks for no return, the perfectly unselfish person, is the most successful.",Swami Vivekananda,etc;hinduism;inspirational;religious,248
1550,"War is an ugly thing, but not the ugliest of things: the decayed and degraded state of moral and patriotic feeling which thinks that nothing is worth a war, is much worse. When a people are used as mere human instruments for firing cannon or thrusting bayonets, in the service and for the selfish purposes of a master, such war degrades a people. A war to protect other human beings against tyrannical injustice; a war to give victory to their own ideas of right and good, and which is their own war, carried on for an honest purpose by their free choice, — is often the means of their regeneration. A man who has nothing which he is willing to fight for, nothing which he cares more about than he does about his personal safety, is a miserable creature who has no chance of being free, unless made and kept so by the exertions of better men than himself. As long as justice and injustice have not terminated their ever-renewing fight for ascendancy in the affairs of mankind, human beings must be willing, when need is, to do battle for the one against the other.","John Stuart Mill,",ethics;fight;foreign-policy;injustice;inspirational;justice;morality;motivational;patriotic;safety;selfish;tyranny;war;will,236
1551,"Security is mostly a superstition. It does not exist in nature, nor do the children of men as a whole experience it. Avoiding danger is no safer in the long run than outright exposure. Life is either a daring adventure, or nothing.","Helen Keller,",challenges;inspirational;life,236
1552,"To those human beings who are of any concern to me I wish suffering, desolation, sickness, ill-treatment, indignities—I wish that they should not remain unfamiliar with profound self-contempt, the torture of self-mistrust, the wretchedness of the vanquished: I have no pity for them, because I wish them the only thing that can prove today whether one is worth anything or not—that one endures.","Friedrich Nietzsche,",endurance;friendship;inspirational;philosophy,231
1553,Someday is now.,Gaddy Bergmann,inspirational,230
1554,Your inner strength is your outer foundation,Allan Rufus,inspirational;love;motivation;peace;personal-development;personal-growth;quotes;realization;self;self-discovery;self-help;spiritual-growth;upliftment,230
1555,"And if these mountains had eyes, they would wake to find two strangers in their fences, standing in admiration as a breathing red pours its tinge upon earth's shore. These mountains, which have seen untold sunrises, long to thunder praise but stand reverent, silent so that man's weak praise should be given God's attention.","Donald Miller,",beauty;god;inspirational;mountains;nature;praise,226
1556,"Wherever the art of Medicine is loved, there is also a love of Humanity. ",Hippocrates,inspirational;medicine,226
1557,"The mistake ninety-nine percent of humanity made, as far as Fats could see, was being ashamed of what they were; lying about it, trying to be somebody else.","J.K. Rowling,",being-someone-else;being-someone-else-you-are-not;hating-yourself;hiding;humanity;inspirational;lying;self-acceptance;self-hatred;shame;trying-to-be-like-someone-else,226
1558,The sky is the limit... for some people aim higher nothing is impossible.,Demi Lovato,inspirational,218
1559,"You attract who you are being. When you work at being the type of person that you want to attract, you attract those kinds of people into your life.","Roy T. Bennett,",inspiration;inspirational;inspirational-attitude;inspirational-life;inspirational-quotes;inspire;inspiring;laws-of-attraction;life;life-and-living;life-lessons;life-quotes;living;motivation;motivational;optimism;optimistic;positive;positive-affirmation;positive-life;positive-thinking,211
1560,"Everything is determined, the beginning as well as the end, by forces over which we have no control. It is determined for the insect, as well as for the star. Human beings, vegetables, or cosmic dust, we all dance to a mysterious tune, intoned in the distance by an invisible piper.",Albert Einstein,destiny;einstein;inspirational,346
1561,Not everyon,"Patrick Ness,",inspirational,323
1562,[BURR,"Lin-Manuel Miranda,",hamilton;inspirational;musicals,316
1563,You enter the fores,"Joseph Campbell,",inspirational;life;way,282
1564,It's your life-but only if you make it so.,"Eleanor Roosevelt,",inspirational,281
1565,"Run when you can, walk if you have to, crawl if you must; just never give up.",Dean Karnazes,inspirational;running,274
1566,Il n'y a de réalité que dans l'action,"Jean-Paul Sartre,",action;existentialism;handeln;inspirational;philosophy;reality,254
1567,Pac said Thug Life stood for 'The Hate U Give Little Infants Fucks Everybody'.,"Angie Thomas,",inspirational,252
1568,"Two wrongs don't make a right, but don't three lefts make a right? Two wrongs don't make a right, but don't two negatives make a positive?","Andrew Clements,",andrew;beautiful;clements;inspirational;ironic;life;oxemoron;paradox;wisdom,252
1569,"According to this law [the law of Dharma], you have a unique talent and a unique way of expressing it. There is something that you can do better than anyone else in the whole world--and for every unique talent and unique expression of that talent, there are also unique needs. When these needs are matched with the creative expression of your talent, that is the spark that creates affluence. Expressing your talents to fulfill needs creates unlimited wealth and abundance.",Deepak Chopra,inspirational;talent,251
1570,"All the time you're saying to yourself, 'I could do that, but I won't,' — which is just another way of saying that you can't.","Richard P. Feynman,",failure;humor;inspirational;success,243
1571,What hurts us is what heals us,"Paulo Coelho,",inspirational,240
1572,"Three passions, simple but overwhelmingly strong, have governed my life: the longing for love, the search for knowledge, and unbearable pity for the suffering of mankind. These passions, like great winds, have blown me hither and thither, in a wayward course, over a great ocean of anguish, reaching to the very verge of despair",Bertrand Russell,inspirational,240
1573,"Although my memory's fading, I remember two things very clearly: I am a great sinner and Christ is a great Savior.","John Newton,",biographical;inspirational,239
1574,Distance can ruin even the best of intentions,"Nicholas Sparks,",inspirational;nicholas-sparks;the-rescue,239
1575,None of us will ever accomplish anything excellent or commanding except when he listens to this whisper which is heard by him alone.,Ralph Waldo Emerson,inspirational;self-determination;self-expression,237
1576,At the moment of commitment the entire universe conspires to assist you.,Johann Wolfgang von Goethe,inspirational,237
1577,Success is a lousy teacher. It seduces smart people into thinking they can't lose.,Bill Gates,inspirational,235
1578,It is not enough to be industrious; so are the ants. What are you industrious about?,"Henry David Thoreau,",industriousness;inspirational;purpose,234
1579,Believe in yourself and all that you are. Know that there is something inside you that is greater than any obstacle.,Christian D. Larson,believe;inspirational,234
1580,"Whatsoever a man soweth, that shall he also reap.","Anonymous,",bible;god;inspirational;truth,230
1581,"To progress in life, I don’t focus on how much I have done but on how much I have yet to do.","Idowu Koyenikan,",inspiration;inspirational;motivation,226
1582,Its more fun to think of the future than dwell on the past.,"Sara Shepard,",future;inspirational;past,224
