index,quote,author,tags,likes
756,Turn your obstacles into opportunities and your problems into possibilities.,"Roy T. Bennett,",inspiration;inspirational;inspirational-attitude;inspirational-life;inspirational-quotes;inspire;inspiring;life;life-and-living;life-lessons;life-quotes;living;motivation;motivational;obstacle;opportunity;optimism;optimistic;positive;positive-affirmation;positive-life;positive-thinking;possibility;problem,742
757,"I began to realize how important it was to be an enthusiast in life. He taught me that if you are interested in something, no matter what it is, go at it at full speed ahead. Embrace it with both arms, hug it, love it and above all become passionate about it. Lukewarm is no good. Hot is no good either. White hot and passionate is the only thing to be.","Roald Dahl,",enthusiasm;inspirational;passion;passionate-living,736
758,"Real magic can never be made by offering someone else's liver. You must tear out your own, and not expect to get it back.","Peter S. Beagle,",inspirational;magic;reminding;sacrifice,734
759,"One of the most spiritual things you can do is embrace your humanity. Connect with those around you today. Say, ""I love you"", ""I'm sorry"", ""I appreciate you"", ""I'm proud of you""...whatever you're feeling. Send random texts, write a cute note, embrace your truth and share it...cause a smile today for someone else...and give plenty of hugs.",Steve Maraboli,action;compassion;humanity;inspirational;kindness;life;living-now;motivational;seize-the-day;spirituality;success,733
760,Remember tonight... for it is the beginning of always,Dante,beginnings;inspirational;memory,727
761,My happiness is not the means to any end. It is the end. It is its own goal. It is its own purpose.,"Ayn Rand,",happiness;inspirational;salvation,716
762,It [feminism] is mixed up with a muddled idea that women are free when they serve their employers but slaves when they help their husbands.,G.K. Chesterton,femininism;inspirational;lies,697
763,"It's worth making time to find the things that really stir your soul. That’s what makes you really feel alive. You have to say ‘no’ to other things you’re used to, and do it with all your heart.",Roy T. Bennett,awareness;heart;inspiration;inspirational;inspirational-quotes;inspire;inspiring;life;life-quotes;living;optimism;optimistic;positive;positive-affirmation;positive-life;positive-thinking;soul;soul-and-heart;stir-your-soul;time,694
764,Dreams don't work unless you take action. The surest way to make your dreams come true is to live them.,Roy T. Bennett,action;do;dream;dream-comes-true;dreams;dreams-come-true;dreams-quotes;inspiration;inspirational;inspirational-quotes;inspire;inspiring;life;life-quotes;living;living-life;motivational;motivational-inspirational;positive-affirmation;positive-life;positive-thinking;positivity;take-action;take-actions,690
765,"Go and make interesting mistakes, make amazing mistakes, make glorious and fantastic mistakes. Break rules. Leave the world more interesting for your being here.","Neil Gaiman,",inspirational,688
766,"No, this is not the beginning of a new chapter in my life; this is the beginning of a new book! That first book is already closed, ended, and tossed into the seas; this new book is newly opened, has just begun! Look, it is the first page! And it is a beautiful one!",C. JoyBell C.,a-beautiful-beginning;a-new-beginning;endings;endings-and-beginnings;inspirational;inspirational-life;inspirational-quotes;new-beginnings;the-end,686
767,"We are saved by faith alone, but the faith that saves is never alone.",Martin Luther,christianity;faith;inspirational;religion,683
768,The duty of youth is to challenge corruption.,Kurt Cobain,activism;dissent;inspirational;protest;truth-telling,680
769,There is no passion to be found playing small - in settling for a life that is less than the one you are capable of living.,Nelson Mandela,inspirational,678
770,What is now proved was once only imagined.,William Blake,english-poet;inspirational;knowledge;willpower,677
771,"I don't paint dreams or nightmares, I paint my own reality.",Frida Kahlo,art;dreams;inspirational;nightmares;painting,677
772,"Feet, what do I need them fo",Frida Kahlo,inspirational,668
773,Envy is ignorance,"Ralph Waldo Emerson,",inspirational,665
774,Being happy doesn't mean that everything is perfect. It means that you've decided to look beyond the imperfections.,Gerard Way,inspirational;life,662
775,When you look for a man- what you want to look for is a man with the heart of a poor boy and the mind of a conqueror.,C. JoyBell C.,boys;inspiration;inspirational;inspirational-quotes;man;men;romance-love,660
776,"Don’t only practice your art, but force your way into its secrets, for it and knowledge can raise men to the divine.",Ludwig van Beethoven,inspirational;philosophy;wisdom,654
777,"Let today be the day you stop being haunted by the ghost of yesterday. Holding a grudge & harboring anger/resentment is poison to the soul. Get even with people...but not those who have hurt us, forget them, instead get even with those who have helped us.","Steve Maraboli,",action;anger;change;grudges;inspirational;life;living-in-the-present;motivational;poison;resentment;seize-the-day;soul;success,653
778,"You don’t have to like someone, but you have to treat them as you wish to be treated.","Roy T. Bennett,",inspiration;inspirational;inspirational-attitude;inspirational-life;inspirational-quotes;inspire;inspiring;life;life-and-living;life-lessons;life-quotes;living;optimism;optimistic;positive;positive-affirmation;positive-life;positive-thinking,588
779,"If you don't know who you truly are, you'll never know what you really want.",Roy T. Bennett,authentic-living;authentic-self;authenticity;be-yourself;inspiration;inspirational;inspirational-quotes;inspire;inspiring;life;life-quotes;living;who-you-are,557
780,You’re not obligated to win. You’re obligated to keep trying. To the best you can do everyday.,Jason Mraz,failure;inspirational;life;success;truth;winning,735
781,You must find the place inside yourself where nothing is impossible.,Deepak Chopra,inspirational,701
782,"Never let hard lessons harden your heart; the hard lessons of life are meant to make you better, not bitter.","Roy T. Bennett,",growing;heart;humanity;inspiration;inspirational;inspirational-attitude;inspirational-life;inspirational-quotes;inspire;inspiring;learning;life;life-and-living;life-lessons;life-quotes;living;optimism;optimistic;positive;positive-affirmation;positive-life;positive-thinking;what-matters,694
783,You become what you think about all day long.,Ralph Waldo Emerson,inspirational;obsession,685
784,"Every great dream begins with a dreamer. Always remember, you have within you the strength, the patience, and the passion to reach for the stars to change the world.",Harriet Tubman,inspirational,684
785,"Sit in a room and read--and read and read. And read the right books by the right people. Your mind is brought onto that level, and you have a nice, mild, slow-burning rapture all the time.","Joseph Campbell,",advice-for-daily-living;inspirational;reading,681
786,"So early in my life, I had learned that if you want something, you had better make some noise.","Malcolm X,",accomplishment;action;impetus;inspirational,681
787,Try again. Fail again. Fail better.,Samuel Beckett,existentialism;failure;inspirational,676
788,Heaven can be found in the most unlikely corners.,"Mitch Albom,",inspirational,675
789,"Freedom is never more than one generation away from extinction. We didn't pass it to our children in the bloodstream. It must be fought for, protected, and handed on for them to do the same, or one day we will spend our sunset years telling our children and our children's children what it was once like in the United States where men were free.",Ronald Reagan,freedom;inspirational;personal-freedom,674
790,"The Reality of The Other Person Lies Not In What He Reveals To You, But What He Cannot Reveal To You",Kahlil Gibran,inspirational,671
791,Learning to distance yourself from all the negativity is one of the greatest lessons to achieve inner peace.,"Roy T. Bennett,",inner-peace;inspiration;inspirational;inspirational-quotes;inspire;inspiring;life;life-quotes;living;optimism;optimistic;peace;positive;positive-affirmation;positive-life;positive-thinking,670
792,Most of us must learn to love people and use things rather than loving things and using people.,"Roy T. Bennett,",being-human;happiness;human;human-nature;humanism;humanity;inspiration;inspirational;inspirational-attitude;inspirational-life;inspirational-quote;inspirational-quotes;inspire;inspiring;learning;life;life-and-living;life-lessons;life-philosophy;life-quotes;living;love;optimism;optimistic;positive;positive-affirmation;positive-life;positive-thinking,670
793,"Never respond to an angry person with a fiery comeback, even if he deserves it...Don't allow his anger to become your anger.","Bohdi Sanders,",anger;anger-management;ataraxy;bushido;inner-peace;inspirational;life;life-experience;life-lessons;martial-arts;motivational;self-control;serenity;warrior-ethos;warriors;warriorship;wisdom,664
794,"I postpone death by living, by suffering, by error, by risking, by giving, by losing.",anaïs nin,inspirational,658
795,"Bermimpilah, karena Tuhan akan memeluk mimpi-mimpi itu.","Andrea Hirata,",inspirational,654
796,"Instead of cursing the darkness, light a candle.",Ben Franklin,inspirational;proverb,652
797,"Think, Believe, Dream, and Dare.",Walt Disney,inspirational,652
798,"The best way to measure how much you've grown isn't by inches or the number of laps you can now run around the track, or even your grade point average-- though those things are important, to be sure. It's what you've done with your time, how you've chosen to spend your days, and whom you've touched this year. That, to me, is the greatest measure of success.","R.J. Palacio,",inspirational,649
799,"Down on the lake rosy reflections of celestial vapor appeared, and I said, ""God, I love you"" and looked to the sky and really meant it. ""I have fallen in love with you, God. Take care of us all, one way or the other."" To the children and the innocent it's all the same.","Jack Kerouac,",god;inspirational;love;spiritual,649
800,"Darling, when things go wrong in life, you lift your chin, put on a ravishing smile, mix yourself a little cocktail...",Sophie Kinsella,humour;inspirational;lifestyle;women-s-strength,648
801,"See, as much as you want to hold on to the bitter sore memory that someone has left this world, you are still in it","Jodi Picoult,",inspirational;mourning,645
802,Life is a gift. Don't forget to live it.,"Nicola Yoon,",inspirational;life;love;young-adult,644
803,Some things cannot be taught; they must be experienced. You never learn the most valuable lessons in life until you go through your own journey.,Roy T. Bennett,experience;inspiration;inspirational;inspirational-quotes;inspire;inspiring;learning;lessons-in-life;life;life-quotes;living;optimism;optimistic;positive;positive-affirmation;positive-life;positive-thinking;teach,644
804,"If we will be quiet and ready enough, we shall find compensation in every disappointment.","Henry David Thoreau,",compensation;disappointment;failure;hope;inspirational,641
805,Congratulations,"Dr. Seuss,",humor;inspirational;success,638
806,"I disregard the proportions, the measures, the tempo of the ordinary world. I refuse to live in the ordinary world as ordinary women. To enter ordinary relationships. I want ecstasy. I am a neurotic — in the sense that I live in my world. I will not adjust myself to the world. I am adjusted to myself.","Anaïs Nin,",inspirational,638
807,"I didn't come here of my own accord, and I can't leave that way",Rumi,inspirational,633
808,A creative life cannot be sustained by approval any more than it can be destroyed by criticism.,Will Self,criticism;inspirational,625
809,Gratitude builds a bridge to abundance.,"Roy T. Bennett,",inspiration;inspirational;inspirational-attitude;inspirational-life;inspirational-quotes;inspire;inspiring;life;life-and-living;life-lessons;life-quotes;living;motivation;motivational;optimism;optimistic;positive;positive-affirmation;positive-life;positive-thinking,551
810,The tears of the world are a constant quantity. For each one who begins to weep somewhere else another stops. The same is true of the laugh.,"Samuel Beckett,",crying;equilibrium;inspirational;tears,806
811,"I've had a lot of worries in my life, most of which never happened.",Mark Twain,inspirational;positive;worries,716
812,"The only position that leaves me with no cognitive dissonance is atheism. It is not a creed. Death is certain, replacing both the siren-song of Paradise and the dread of Hell. Life on this earth, with all its mystery and beauty and pain, is then to be lived far more intensely: we stumble and get up, we are sad, confident, insecure, feel loneliness and joy and love. There is nothing more; but I want nothing more.","Ayaan Hirsi Ali,",atheism;death;inspirational;life,712
813,"There are times when solitude is better than society, and silence is wiser than speech. We should be better Christians if we were more alone, waiting upon God, and gathering through meditation on His Word spiritual strength for labour in his service. We ought to muse upon the things of God, because we thus get the real nutriment out of them. . . . Why is it that some Christians, although they hear many sermons, make but slow advances in the divine life? Because they neglect their closets, and do not thoughtfully meditate on God's Word. They love the wheat, but they do not grind it; they would have the corn, but they will not go forth into the fields to gather it; the fruit hangs upon the tree, but they will not pluck it; the water flows at their feet, but they will not stoop to drink it. From such folly deliver us, O Lord. . . .",Charles Spurgeon,bible;christian;faith;inspirational,701
814,Why Not You,"Steve Maraboli,",happiness;inspirational;inspirational-poem;life;motivational;seize-the-day,696
815,the time is always right to do the right thing,Martin Luther King Jr.,inspirational,677
816,"If you want to write a fantasy story with Norse gods, sentient robots, and telepathic dinosaurs, you can do just that. Want to throw in a vampire and a lesbian unicorn while you're at it? Go ahead. Nothing's off limits. But the endless possibility of the genre is a trap. It's easy to get distracted by the glittering props available to you and forget what you're supposed to be doing: telling a good story. Don't get me wrong, magic is cool. But a nervous mother singing to her child at night while something moves quietly through the dark outside her house? That's a story. Handled properly, it's more dramatic than any apocalypse or goblin army could ever be.",Patrick Rothfuss,fantasy;fantasy-books;inspirational;writing,667
817,"In school we learn that mistakes are bad, and we are punished for making them. Yet, if you look at the way humans are designed to learn, we learn by making mistakes. We learn to walk by falling down. If we never fell down, we would never walk.","Robert T. Kiyosaki,",humanity;inspirational;mistakes;risk;school,665
818,It takes sunshine and rain to make a rainbow. There would be no rainbows without sunshine and rain.,"Roy T. Bennett,",inspiration;inspirational;inspirational-attitude;inspirational-life;inspirational-quotes;inspire;inspiring;life;life-and-living;life-lessons;life-quotes;living;motivation;motivational;optimism;optimistic;positive;positive-affirmation;positive-life;positive-thinking;rainbow;rainbows,660
819,"Great things are not done by impulse, but by a series of small things brought together.",Vincent Van Gogh,inspirational,659
820,"When one has a grateful heart, life is so beautiful.","Roy T. Bennett,",gratitude;inspiration;inspirational;inspirational-attitude;inspirational-life;inspirational-quotes;inspire;inspiring;life;life-and-living;life-lessons;life-quotes;living;optimism;optimistic;positive;positive-affirmation;positive-life;positive-thinking,653
821,"Maktub"" (It is written.)","Paulo Coelho,",inspirational,653
822,"The best relationships in our lives are the best not because they have been the happiest ones, they are that way because they have stayed strong through the most tormentful of storms.","Pandora Poikilos,",healing;inspirational;relationships;self-help,637
823,We cannot be sure of having something to live for unless we are willing to die for it.,Che Guevara,bravery;carpe-diem;commitment;courage;here-and-now;indiviuality;inspirational;passion,628
824,"When I was little and running on the race track at school, I always stopped and waited for all the other kids so we could run together even though I knew (and everybody else knew) that I could run much faster than all of them! I pretended to read slowly so I could ""wait"" for everyone else who couldn't read as fast as I could! When my friends were short I pretended that I was short too and if my friend was sad I pretended to be unhappy. I could go on and on about all the ways I have limited myself, my whole life, by ""waiting"" for people. And the only thing that I've ever received in return is people thinking that they are faster than me, people thinking that they can make me feel bad about myself just because I let them and people thinking that I have to do whatever they say I should do. My mother used to teach me ""Cinderella is a perfect example to be"" but I have learned that Cinderella can go fuck herself, I'm not waiting for anybody, anymore! I'm going to run as fast as I can, fly as high as I can, I am going to soar and if you want you can come with me! But I'm not waiting for you anymore.",C. JoyBell C.,achievement;breaking-free;changing;cinderella;flying;freedom;fulfilling-your-potential;fulfillment;goodbye-cinderella;growing;inspirational;inspirational-quotes;inspiring;learning;life;life-and-living;limits;living;living-life;personal-fulfillment;personal-limits;potential;running;self-discovery;self-growth;soaring;waiting;your-full-potential,626
825,The greatest ideas are the simplest.,"William Golding,",inspirational;simplicity,625
826,Do you really want to be happy? You can begin by being appreciative of who you are and what you've got.,"Benjamin Hoff,",inspirational;taoism;winnie-the-pooh,620
827,Know thyself.,Socrates,inspirational,620
828,"I've been lucky. Opportunities don't often come along. So, when they do, you have to grab them.",Audrey Hepburn,inspirational,614
829,"I’ve come to the conclusion that people who wear headphones while they walk, are much happier, more confident, and more beautiful individuals than someone making the solitary drudge to work without acknowledging their own interests and power.",Jason Mraz,confidence;inspirational;life;music;power;spiritual;truth;work,612
830,"Words can never fully say what we want them to say, for they fumble, stammer, and break the best porcelain. The best one can hope for is to find along the way someone to share the path, content to walk in silence, for the heart communes best when it does not try to speak.","Margaret Weis,",inspirational;love,612
831,"It is the possibility that keeps me going, and though you may call me a dreamer or a fool or any other thing, I believe that anything is possible.",Nicholas Sparks,inspirational;love;optimism;possibilities,611
832,"If my mind can conceive it, and my heart can believe it - then I can achieve it.","Muhammad Ali,",inspirational,611
833,They laugh at me because I'm different; I laugh at them because they're all the same.,Kurt Cobain,different;humor;inspirational;misattributed;same;society,608
834,Life begins on the other side of despair.,Jean-Paul Sartre,inspirational,600
835,"The truth knocks on the door and you say, ""Go away, I'm looking for the truth,"" and so it goes away. Puzzling.","Robert M. Pirsig,",inspirational;truth;zen,600
836,"I am always doing what I cannot do yet, in order to learn how to do it.",Vincent Van Gogh,inspirational,596
837,People have only as much liberty as they have the intelligence to want and the courage to take.,Emma Goldman,anarchism;independence;independent-thought;inspirational;liberty;revolution,593
838,"Challenge and adversity are meant to help you know who you are. Storms hit your weakness, but unlock your true strength.","Roy T. Bennett,",adversity;challenge;inspiration;inspirational;inspirational-attitude;inspirational-life;inspirational-quotes;inspire;inspiring;life;life-and-living;life-lessons;life-quotes;living;motivation;motivational;optimism;optimistic;positive;positive-affirmation;positive-life;positive-thinking;potential,547
839,Nothing makes a person happier than having a happy heart.,Roy T. Bennett,happiness;happy;happy-heart;heart;inspiration;inspirational;inspirational-quotes;inspire;inspiring;life;life-quotes;living;optimism;optimistic;positive;positive-affirmation;positive-life;positive-thinking,508
840,"We all need to be mocked from time to time, lest we take ourselves too seriously.",George R.R. Martin,inspirational,883
841,"If we ever forget that we're one nation under God, then we will be one nation gone under.",Ronald Reagan,inspirational;religon;separation-of-church-and-state,695
842,"Growing up means learning what life is. When you're little, you have a set of ideals, standards, criteria, plans, outlooks, and you think that you have to sit around and wait for them to happen to you and then life will work. But life isn't like that, for anybody; you can't fall in love with a standard, you have to fall in love with a person. You can't live in a criteria, you have to live your life. You can't wait for your plans to materialize, because they may never materialize the way you think they will. You can't wait to watch your ideals and standards walk up to you, because you can't know what's yours until you have it. I always say, always take the first chance in case you never get a second one, but growing up takes that even one step further, growing up means that you have to hold on to what you have, when you have it, because what you have- that's yours- and all the ideals and criteria you have set in your head, those aren't yours, because those haven't happened to you.",C. JoyBell C.,growing;growth;humanism;humanity;inspirational;inspirational-life;inspirational-quotes;learning;life;life-and-living;life-experiences;life-lessons,679
843,"Friendship with oneself is all important, because without it one cannot be friends with anyone else in the world.",Eleanor Roosevelt,inspirational;self-acceptance,659
844,"I'm going to paraphrase Thoreau here... rather than love, than money, than faith, than fame, than fairness... give me truth. ","Jon Krakauer,",inspirational,630
845,"For everything in this journey of life we are on, there is a right wing and a left wing: for the wing of love there is anger; for the wing of destiny there is fear; for the wing of pain there is healing; for the wing of hurt there is forgiveness; for the wing of pride there is humility; for the wing of giving there is taking; for the wing of tears there is joy; for the wing of rejection there is acceptance; for the wing of judgment there is grace; for the wing of honor there is shame; for the wing of letting go there is the wing of keeping. We can only fly with two wings and two wings can only stay in the air if there is a balance. Two beautiful wings is perfection. There is a generation of people who idealize perfection as the existence of only one of these wings every time. But I see that a bird with one wing is imperfect. An angel with one wing is imperfect. A butterfly with one wing is dead. So this generation of people strive to always cut off the other wing in the hopes of embodying their ideal of perfection, and in doing so, have created a crippled race.",C. JoyBell C.,ancient;flight;flying;human-race;humanity;imperfection;inspirational;inspirational-life;inspirational-quotes;inspiring;journey;life;life-and-living;life-s-journey;living;living-life;people;perfect;perfection;the-journey;truth;two-wings;wings;wisdom;wisdom-quotes,622
846,It doesn’t matter how many times you get knocked down. All that matters is you get up one more time than you were knocked down.,Roy T. Bennett,ability;don-t-give-up;inspiration;inspirational;inspirational-quotes;inspire;inspiring;leader;leaders;leadership;life;life-quotes;living;motivation;motivational;never-give-up;optimism;optimistic;perseverance;persistence;positive;positive-affirmation;positive-life;positive-thinking;vision,620
847,"Failure is a bend in the road, not the end of the road. Learn from failure and keep moving forward.",Roy T. Bennett,change;failure;failures;inspiration;inspirational;inspirational-quotes;inspire;inspiring;keep-going;keep-moving-forward;learn;learning;life;life-quotes;living;motivation;motivational;optimism;optimistic;perseverance;positive;positive-affirmation;positive-life;positive-thinking;risk;success,615
848,"E.L. Doctorow said once said that 'Writing a novel is like driving a car at night. You can see only as far as your headlights, but you can make the whole trip that way.' You don't have to see where you're going, you don't have to see your destination or everything you will pass along the way. You just have to see two or three feet ahead of you. This is right up there with the best advice on writing, or life, I have ever heard.","Anne Lamott,",inspirational;life;writing,615
849,"It takes guts and humility to admit mistakes. Admitting we're wrong is courage, not weakness.","Roy T. Bennett,",courage;inspiration;inspirational;inspirational-attitude;inspirational-life;inspirational-quotes;inspire;inspiring;life;life-and-living;life-lessons;life-quotes;living;mistakes;motivation;motivational;optimism;optimistic;positive;positive-affirmation;positive-life;positive-thinking,608
